Topic,Publication,Title,Link"
Urban Analytics,Rpubs,A Semantic Analysis of Chicago Rodent Discourse Using Reddit Data,http://rpubs.com/enskygin/chicago-rat-semantic-analysis"
Urban Analytics,Github,Rats!,http://rchadha33.github.io/RatSight/#1"
Urban Analytics,Github,Tracking Urban Rails-to-trails Discourse on Reddit,http://mohsinyousufi.github.io/cp8883report/"
Urban Planning,UIC Energy Initiative ,Chicago Park Districts as an Urban Refuge,http://www.youtube.com/watch?v=zEazTh8WjFw&ab_channel=UICEnergyInitiative"
Product Development,WBEZ Chicago,New Card Game Captures The Ups And Downs of Life On The CTA,http://www.wbez.org/stories/new-card-game-captures-the-ups-and-downs-of-life-on-the-cta/f4b73ba5-ecfc-4f81-b75a-2820f19ad1d3"